page,title,article,category
https://www.bbc.com/news/business-56592411,UK exporters consider 'worst case scenario' plans,"An initial 41% plunge in goods going to the EU in January was described by the government as ""teething problems"" which it said were hard to separate out from the impact of COVID-related disruption.,The government insists that ""overall freight volumes between the UK and the EU"" have been back to their normal levels since the start of February, and that there is no general disruption at UK ports.,However, haulage groups insist recent figures on freight volume tally the number of vehicles and ferry movements, rather than the value of the actual goods traded between the EU and UK and many more lorries than before are returning to the EU empty. An admittedly small sample of members of the Federation of Small Business found that one in four exporters had paused sales to the EU and 11% were considering abandoning exports to the bloc completely. ,Scott Clarke is a director at Rex London, a specialist gift company selling goods all over Europe. He described January as ""chaotic"". There were delays and confusion at customs, additional freight costs, and extra charges for his EU customers in the form of duties and taxes.  Many of his shipments weren't getting through at all and were returned to his warehouse in west London.,""We had hundreds of boxes we tried to send in January, and they all came back,"" says Scott.,""There was probably a three or four week period at the beginning of the year where we couldn't supply our customers at all, which is a big deal for us because over half of our business is with Europe."",He acknowledges that things have got better, but many of the difficulties they have faced are here to stay.,""It has calmed down a lot. We can supply our customers in Europe now. But we're three months in, and this doesn't seem sustainable in the longer term,"" he adds. ,""There's been a lot of talk about teething issues. There were teething issues, but they were just part of the underlying problems that haven't gone away."",What's the solution? For Scott, it's to establish a warehouse in Belgium so he can better serve his customers in Europe, without customs delays and extra costs. It's something they previously saw as a ""worst case scenario"" option, and he says there'll be negative consequences for the UK. ,""Splitting off part of our business and sending it to Belgium probably means that further growth is going to be happening there. Instead of taking on new staff here, we'll employ them there. Instead of making more profit and paying more tax here, we'll pay it there. Basically, everyone is losing out here,"" he says.,He's not the only one looking at establishing a base in the EU. The BBC has spoken to a number of investment agencies around Europe - including in Germany, Belgium, Austria and France. All of them say they've seen a big increase in the number of UK businesses expressing an interest in moving some of their operations across the channel. The Netherlands is emerging as a favourite destination. ,Michiel Bakhuizen is from the Netherlands Foreign investment Agency. They have been in talks with over 600 UK businesses since the Brexit referendum, and the monthly numbers have increased since the start of this year.,""In January, 40 companies made enquiries, in February it doubled to 80 companies, and up until the middle of March it was 40 again, so interest is really growing. The numbers have more than doubled on the average month in 2020,"" says Michiel.,""Interest has grown since January, because of the real difficulties Brexit is causing some companies in the UK. They're talking about administrative hurdles, supply chain related problems, licensing issues, so those problems are real and that's why those companies are showing interest in the Netherlands and other countries."",Michiel is keen to point out there are downsides for the Netherlands too.,""The Netherlands is not 'winning' this. If you look at Brexit from a macro perspective, the Netherlands just lost its second biggest trading partner, moving outside the European Union and the single market,"" he says. ,""Obviously attracting foreign business towards the Netherlands is growing because UK businesses need a future in the European market, and the Netherlands is there to help them to secure that, but in the end Brexit is not good news for the Netherlands."",For other exporters to the EU, shifting some of the business closer to their customers just isn't an option. ,Sarah Braithwaite's company, Forage Plus, specialises in nutritional products for horses, which have proved to be very popular with European customers in recent years. They're based in North Wales, but up until January, they were able to ship their goods to 20 European countries within a matter of days. Not anymore. One package she sent to Sweden in January still hasn't arrived, with customs officers there requesting additional documentation to clear it, from manufacturing flow charts to photos of individual products. But there are other issues too. ,""It's been frustrating, demoralising, upsetting. For a while we just thought it was a hold-up at customs, just the sheer volume of shipments and they couldn't cope. And then we realised we weren't going to be able to get our parcels into Europe without our customers paying quite big import duties,"" she says.,Rather than shipping to other businesses in Europe, Sarah sends her goods directly to customers, who have been faced with unexpected duties and taxes, as high as 40% of the original price, depending on which EU country it goes to. Together with customs delays, it's meant that orders have dried up, and she's had to refund thousands of pounds.,""For us, as a company shipping into Europe, a typical month would be around 160, 170, 180 orders into 18 to 20 different countries. Today, when I asked my staff how many we have into Europe, there are none. How many orders have we had this month? Two or three,"" she says.,""If a customer orders from Europe today, we can't actually get it to them. In some instances we can't get it to them at all, and in others, they're charged such a large amount of import duty that they're just not going to do that. We're going to lost that custom."",Sarah hasn't given up entirely and is trying to find ways to keep supplying her customers. A Dutch warehouse isn't on the cards though.,""It's unrealistic to say, set up some kind of European warehouse when you haven't got the finances or the manpower. We would have to employ new people. How are we going to employ new people when we've just lost £300,000 worth of business? It's just not realistic, it really isn't."",The government has set up a £20m Brexit Support Fund for small and medium-sized businesses and is also providing export helplines, and webinars with a network of 300 international trade experts.,This assistance has been welcomed and the Federation of Small Businesses has called for an increase in the size of the support fund.  ,But the provision of this support is perhaps a tacit acknowledgement on the part of the government that something that was once easy and cheap is now difficult and expensive. Given that the EU accounts for nearly half of all UK exports, that is a reality that cannot be good for the UK economy. ,Much-vaunted trade deals with countries including the US, Australia, New Zealand and others have not yet arrived and the government's own analysis said deals with all of them would add less than 1% to UK GDP in 15 years' time and fail to offset the hit to trade with the EU. ,The tariff-free trade with the EU that the Brexit deal secured is welcomed by business but tariffs are only a small part of the picture. What many businesses are discovering is that exporting requires time, investment and expertise. For decades, sending goods to Berlin was as easy as sending goods to Birmingham - as a member of a single market without trade borders or barriers, it wasn't really exporting at all. ,Michael Gove said he hoped the exporting expertise firms are acquiring (reluctantly in many cases) will make them ""match fit"" to grasp new opportunities beyond the EU. ,But back in west London, Scott says the last three months have highlighted the challenges businesses face in sending their goods anywhere around the world.,""One of the great irritations for me is the idea that we're going to suddenly be free to export more around the world. It's just not true. Exporting is really difficult. I think if anything, people will now know how difficult it is.""",politics
https://www.bbc.com/news/uk-england-london-55748037,London mayoral race 2021: The candidates standing in this year's election,"More than six million people are registered to vote in the capital with the mayoral election normally taking place every four years.,This election was originally scheduled to take place in May 2020 but it was ,These are the candidates who have said they intend to stand for mayor this year (listed alphabetically):,A former youth worker who currently serves as a Conservative on the London Assembly.,The Renew party candidate has worked in the field of international law, global risk and transnational business.,The co-leader of the Green Party currently serves as a London Assembly member and councillor in Camden.,A self-proclaimed interplanetary space warrior, who has challenged both Boris Johnson and Theresa May in general elections.,Burning Pink's candidate describes herself as a mother, grandmother and vigilante.,A long-term weather forecaster who is the older brother of former Labour leader Jeremy Corbyn.,A YouTuber and former radio presenter.,An actor who set up the Reclaim Party in 2020.,UKIP's candidate describes himself as motivational speaker, broadcaster and author who has spoken at world conferences and events.,An anti-Brexit campaigner who runs a company that offers training courses in the financial sector. ,The leader of the Animal Welfare Party and film director. ,Served as MP for Tooting for 11 years before he was elected mayor of London in 2016.,A former Brexit Party candidate at the general election.,A former teacher who sits with the Brexit Alliance Group on the London Assembly.,The Croydon-born businesswoman has worked in the commercial sector for 22 years.,A pastor who is chief executive of The Peace Alliance, which was set up to tackle knife crime.,A YouTuber known for his prank style videos.,A Camden councillor who served as an MEP for the Lib Dems between 2019 and 2020.,The leader of the Women's Equality Party has worked for all three of London's previous mayors on various projects.,A former banker who founded the media firm London Real.",politics
https://www.bbc.com/news/uk-england-norfolk-56589398,Brexit: Businesses find 'teething problems' trading with the EU,"Captain Fawcett Ltd is based in King's Lynn, Norfolk, and the majority of its male grooming products are exported, with 51% going into Europe.,Director Richard Finney says the last three months have been ""particularly difficult"" in terms of getting products to their destination.,""We are quite used to shipping paperwork as we do that for other countries,"" he says.,""But we found a lot of obstruction.,""Where a parcel normally takes two days, it's been taking up to two months to arrive in some instances."",Mr Finney says he has parcels that are still ""stuck"" in Spain, Poland and Germany.,""Our paperwork is correct, but we are finding different countries are making their own individual requirements,"" he says.,""You can send off a parcel and have no idea if or when it will get there."",Mr Finney says he hopes the issues are just ""teething problems"" as staff are ""working round the clock"" to ensure things run as smoothly as possible.,Suffolk pig farmer Alastair Butler says ""things are starting to move again"" after a tricky to start to the year due to paperwork problems.,""The marketplace seemed to close for about a month to six weeks,"" he says.,This led to livestock not being moved off the farm, in Southwold, which Mr Butler hopes will not happen again.,""We had a build-up of pigs,"" he says.,""Luckily as an outdoor pig producer we have a little bit more space so we could handle that, but if it carried on it could have caused some serious animal welfare situations."",The farmer says while the situation has improved, there are ""still a few kinks to iron out with the system"".,He says he would ideally like to see more people buying British pork to help farmers who have had to ""soak up some of the costs"" of a slow start to the year.,""It's been difficult for pig farmers, but things are starting to improve and we're hoping for a brighter future,"" he says.,New rules have come into force for those in the UK either importing or exporting with European Union countries.,Exactly what licences are needed or what duties must be paid depends on what is being exported, its value, where the product originates from and to which country it is being sent, ,.,From 1 January, the UK government introduced a rule that VAT must be collected at the point of sale rather than the point of import.,This essentially means that overseas retailers sending goods to the UK are expected to register for UK VAT and account for it to HMRC if the sale value is less than €150 (£135).,For Steven Williamson, director of Lynn Shellfish in King's Lynn, things are ""definitely getting easier"".,He says the company's first load of produce was delayed for five days, but exports are now getting to their destination within 24 hours.,""We are getting our heads around it,"" he says.,""The EU are not taking live product, so we will have to cook all of our cockles as part of a purification process."",Mr Williamson says the business can ""handle"" the change, but he feels it is ""more of a pain for European customers"" who wants live products.,""It's a strange situation,"" he says.,""The hassle we've had to deal with is the hassle I expected with no deal.,""If you've done a deal things should run smoothly and it hasn't."",Despite the hurdles of leaving the EU, Mr Williamson believes the UK will be better off in the long run.,Everyone seems to be agreed that things have calmed down. Firms are getting their heads around the paperwork, customs officers on the continent are accepting it. ,There are still delays and a few shortages, but it's not as bad as at the start of the year.,It has come at a price. Companies complain that Brexit has produced a lot more red tape which the Norfolk Chamber of Commerce says has pushed up the cost of exporting by 35%.,There is still a sense of nervousness that things could get difficult again at any time - disputes over vaccine supply, sale of fresh shellfish and Northern Ireland border issues could easily flare up into a full blown trade war.,For companies in the region, Brexit has become yet another challenge to deal with in 2021.,eastofenglandnews@bbc.co.uk",politics
https://www.bbc.com/news/uk-wales-56590487,Racist graffiti on Books Council of Wales HQ in Aberystwyth,"A swastika and ""Wales 4 white"" was discovered written on the Books Council of Wales headquarters in Aberystwyth, Ceredigion, on Tuesday morning, its chief executive said.,Helgard Krause, who is openly gay, said it had ""horrified"" her and her colleagues who reported it to Dyfed-Powys Police.,The force said it was investigating.,Last month the force received a separate report of racist graffiti in another part of Aberystwyth.,A spokesman said they were not currently linking the two crimes.,Ms Krause said it was difficult to say if the graffiti was targeted.,""I am German so the swastika is particularly problematic to me and it's illegal in Germany,"" she said.,""It's got a lot of negative weight for me."",Ms Krause, who lives outside of the town with her wife, said the vandalism was discovered on Tuesday morning by one of her colleagues who could not work from home.,The colleague took a picture of it and sent it to her which she later tweeted.,She accompanied the picture with the following message: ""To whomever who daubed our building in racist and Nazi graffiti: it will do nothing for your cause.,""The opposite, it has strengthened my resolve to address the inequalities that exist in our society wherever we find it."",The Welsh government-funded organisation, which promotes books and literature related to Wales, is not the only building to be targeted in the town.,Last June the nearby Cofiwch Dryweryn mural was vandalised with a swastika and a white power symbol.,The artwork - commemorating the flooding of a Welsh village to create a reservoir - was restored later the same day.,Elin Jones MS, who has represented Ceredigion for Plaid Cymru at the Senedd since 1999, tweeted at the time: ""Wal Tryweryn restored and hateful, racist symbols removed."",A spokesman for Dyfed Powys police said: ""We received a report of criminal damage at Castell Brychan, Aberystwyth, on Tuesday, 30 March.,""Enquiries are ongoing. Anyone with information is asked to contact us.""",politics
https://www.bbc.com/news/uk-england-tees-56593080,Re-named Brexit Party - Reform UK - announces by-election candidate,"John Prescott, 46, who previously stood for the party in Stockton, has been chosen to represent Reform UK. ,Dr Paul Williams has been , to replace Mike Hill, who , of sexual harassment which he denies.,Farmer Jill Mortimer , in the election which will be held on 6 May.,Thelma Walker, the former Labour MP for Colne Valley, ,.,A spokesman for Reform UK described Mr Prescott as a ""proud father and a self-employed businessman who will be the strong voice in Westminster that Hartlepool needs"".",politics
https://www.bbc.com/news/uk-wales-politics-56582560,Welsh election: Pledge to treble council tax for second homes,"Plaid is proposing to increase the council tax premium that can be charged on second homes from 100% to 200%.,The party is also proposing to cap the number of second homes in an area and change the rules so that they cannot be registered as businesses.,Conservatives called it a ""veiled attack"" on Wales' visitor economy.,But Plaid says the policies are necessary to prevent rural communities from losing a ""generation of young people"" because of the ""second homes crisis"".,There were 24,873 second homes registered in Wales for council tax purposes in January 2021, ,. ,Gwynedd has the highest number of second homes - 5,098 - 20% of all second homes in Wales.,Pembrokeshire has 4,068 registered, Cardiff has 3,477, Anglesey 2,139 and 2,104 in Swansea.,Since 2017, Welsh councils have had the right to charge a council tax premium of up to 100% on second homes.,In the 2020/21 financial year, , - Conwy and Ceredigion have been charging 25%; Anglesey has been charging 35%; whilst Gwynedd, Denbighshire, Flintshire, Powys and Pembrokeshire councils have been charging a 50% premium. ,Swansea council became the first in Wales to decide , from 1 April 2021, with , recently backing the full charge. ,Concerns have been raised that some second home-owners have designated ,, meaning they pay no council tax at all., On 6 May, people across Wales will vote to elect 60 Members of the Senedd (MSs). The party or parties that can command the support of a majority of members will form the Welsh government.  ,., MSs pass laws on many aspects of day-to-day life in Wales, such as health, education and transport. They also have control over some taxes. Defence, foreign policy and immigration are decided by the UK Parliament., Anyone who lives in Wales and is registered to vote is eligible, so long as they are aged 16 or over on the day of the election. ,.,Mabon ap Gwynfor, Plaid's candidate for the Dwyfor Meirionnydd constituency in Gwynedd said his party in power would ""close the loophole that currently allows second homes to be registered as 'businesses'"" as well as increase the maximum premium to 200%.,He added: ""In addition, a Plaid government would redefine the term 'affordable home' which currently includes properties worth over £250,000 - a figure way out of reach for many young people in our rural communities. ,""Young people are at the heart of our rural communities and a Plaid government would be wholly committed to giving them every opportunity to earn, learn and live in their area of choice, wherever in Wales that may be."",The Welsh Conservative candidate for Dwyfor Meirionnydd, Charlie Evans, said: ""Plaid Cymru are resorting to the same old policies of higher taxes with yet another veiled attack on Wales' brilliant visitor economy.,""Plaid have propped up a number of Labour governments and failed to oppose numerous Labour budgets over the past 22 years, so have to take responsibility for the part they've played in the housing crisis."",""Welsh Conservatives have an ambitious plan to solve the housing crisis and build a better Wales with 100,000 new homes, restoring right to buy and scrapping stamp duty for first time buyers."",In its last Welsh government budget, Labour changed the land transaction tax - the Welsh version of stamp duty - so that , when they buy properties up to £180,000, rising to 16% for homes worth at least £1.6m.,Welsh Labour's Joyce Watson said: ""We recognise the concerns about the effects that large numbers of second homes can have on some of our communities and, in particular, on the long-term sustainability of our Welsh-speaking heartlands."",She added that if Labour was returned to power it would create 20,000 social homes for rent in the next Senedd term and guarantee every young person under 25 the offer of a job, education, training or support to start a business.,Stephen Churchman, Welsh Liberal Democrat candidate for Dwyfor Meirionnydd, said his party would ""crack down on second homes"".,""We will institute legislation that requires local authorities to set council tax at the maximum possible level for all homes other than someone's primary residence,"" he said. ,""We will close loopholes that allow people to designate second homes as businesses and ensure that they pay their way to support the communities locally."",Other candidates expected to stand in Dwyfor Meirionnydd include:",politics
https://www.bbc.com/news/uk-northern-ireland-56589980,Brexit: 'I'm the bogeyman over NI protocol' - Coveney,"He said the irony was that his office has been telling Brussels about the need to understand the tensions in NI.,The protocol is the part of the Brexit deal ,.,It is opposed by unionist parties which have said it undermines their place in the UK.,Mr Coveney said the protocol was not just about Northern Ireland, but about the island as a whole. ,He said dismantling the protocol would mean infrastructure on the border, which would not be accepted politically. ,""We would be taken out of the single market by default,"" said the minister.,""The protocol is not just about Northern Ireland; it is about the island as a whole functioning as it needs to function in order to protect relationships and trade."",He said the protocol was designed as much in London as it was in Brussels, ""but many people seem to conveniently forget that"".,The protocol was not going to be cast aside, but efforts would be made to address ""genuine concerns"", Mr Coveney told the Seanad, Ireland's upper house, earlier this week. ,He added: ""Despite the fact that I have become somewhat of a bogeyman for some people in the context of the protocol and trying to tell people the truth about it, the irony is that the [Irish] government, and my office in particular, has been constantly talking to the European Commission about the need for flexibility, the need to understand the tension in politics in Northern Ireland because of the protocol and its implementation, and the need for pragmatism in terms of implementation."",Graffiti singling out both Tanáiste (Deputy Prime Minister) Leo Varadkar and Mr Coveney ,. ,Earlier this month, the UK government changed how the protocol was being implemented without EU agreement.,It delayed the introduction of new sea border checks on food, parcels and pets.,It also moved unilaterally to ease the trade in horticultural products across from Great Britain to Northern Ireland.,The EU has begun legal action as a consequence.,Mr Coveney said easing the trade burden must be done through cooperation and partnership. ,""We cannot have a situation where one side, whether it be the EU or the UK, decides unilaterally to declare that it is going to implement the protocol in one way or another, in a manner that contravenes not only the spirit of the protocol but the legal obligation under the protocol as well."",The minister said the Republic of Ireland had also suffered trade disruption as a result of Brexit. ",politics
