page,title,article,category
https://www.bbc.com/news/uk-politics-56586939,Ex-politicians should be very careful - minister,"Robert Jenrick told the BBC it was important not to ""harm your office or public life more generally"".,His remarks follow criticism of former Prime Minister David Cameron over his paid role with the financial company Greensill Capital.,Mr Cameron has not commented on the matter.,Labour has asked the Committee on Standards in Public Life to examine his reported part in lobbying the government on behalf of Greensill Capital after it employed him as an adviser.,It has also written to Cabinet Secretary Simon Case, requesting a ""full, transparent and thorough investigation"" into the company's ""links with the Conservatives"". ,The Financial Times has reported that Mr Cameron unsuccessfully tried to increase Greenhill Capital's involvement in a scheme offering government-backed loans to Covid-hit companies.,He was reported to have contacted officials, as well as Chancellor Rishi Sunak.,Politicians have to wait for two years after leaving office before they can be employed as lobbyists, whose job it is to influence government decisions.,Mr Cameron, who was prime minister from 2010 to 2016, started work for Greensill Capital in 2018.,Asked on the BBC News Channel if the rules needed tightening, with the length of the lobbying ban for former office-holders extended, Mr Jenrick said: ""It's difficult to prohibit someone who is a private citizen from making a living.,""A former prime minister is an exceptional example - there is a wide range of people who hold office, different degrees from ministers to local councillors.,""But I do think you have to be very careful how you conduct yourself once you leave office and not to use any privileged information and contacts you have in a way that does harm to your office or public life more generally."",Mr Jenrick, an MP since 2014, said he could not comment on Mr Cameron's specific situation as he did not ""know the details"".,But he added: ""For those of us who are lucky enough to be in public office, when that comes to an end, you do have to exercise great care, what you do next."",And Mr Sunak told ITV it was ""right"" for the Treasury to ""engage with stakeholders"", including companies, ""and we do that all the time when people come with policy suggestions"". ,But ""ultimately"" Greensill Capital's proposal had been ""rejected"", the chancellor added.,The company's founder, Lex Greensill, worked as an unpaid government adviser under the Conservative-Liberal Democrat coalition led by Mr Cameron.,The Sunday Times reported that, during his time in the role, he had promoted a government-backed loans scheme to speed up payments to pharmacists.,Greensill Capital later went on to provide funds for the scheme.,Labour wants the Committee on Standards in Public Life to look into the extent of the access to government offered to Mr Greensill under the coalition.,A Downing Street spokesman said: ""Lex Greensill acted as a Supply Chain Finance Adviser from 2012 to 2015 and as a Crown Representative for three years from 2013.,""His appointment was approved in the normal manner and he was not paid for either role."",Last week, a watchdog cleared Mr Cameron of engaging in lobbying for which he was not registered, saying he was exempt from this requirement as an in-house employee of Greensill Capital.",politics
https://www.bbc.com/news/uk-politics-56578838,David Cameron and Greensill: What's it all about?,"Financier Lex Greensill worked as an unpaid adviser to Mr Cameron when he was prime minister, and developed a policy designed to ensure small firms got their bills paid faster. The scheme also benefited Mr Greensill's own company, Greensill Capital.,Mr Cameron went on to work for Greensill Capital after leaving office, and tried unsuccessfully to lobby the government to increase the firm's access to government-backed loans.,Mr Cameron pressed Treasury officials - including reportedly sending Chancellor Rishi Sunak text messages - for emergency funding for Greensill Capital, a company in which the former prime minister had a financial interest.,Mr Cameron is , he was set to earn as much as £60m from shareholdings in Greensill, where he had worked since 2018.,In the end, Mr Cameron's pleas to the Treasury for emergency loans for Greensill Capital, fell on deaf ears.,The firm has now gone bust, throwing the future of thousands of workers at Liberty Steel, a company backed by the finance house, into doubt.,Mr Cameron didn't appear to do anything wrong, under the current rules.,Big business is always keen to fork out for the influence and contacts a big hitter like Mr Cameron - who stood down as prime minister in 2016 - can supposedly offer.,There is nothing illegal about this kind of lobbying, although critics say it needs to be brought out into the open.,There are rules - ,- aimed at preventing abuses, but critics say they do not go far enough.,Although Mr Cameron was , of breaking lobbying rules, , has shed new light on his dealings with Mr Greensill when he was prime minister, in the early days of the Conservative/Lib Dem coalition. ,In 2012, Mr Greensill was made an unpaid government adviser by Mr Cameron, with a Westminster pass and access to government departments.,He used this access to promote a government-backed loan scheme he had devised.,Mr Cameron and the late Lord Heywood, the most powerful man in the civil service at the time, were fully behind it, believing it would help to deliver on a promise to speed up payments to small firms.,But Mr Greensill also stood to make a lot of money from the scheme, even though the Sunday Times claims many in Whitehall had serious reservations about it.,Mr Greensill's specialism was supply chain finance - a service for companies who don't want to wait months for their bills to be paid.,For a small fee, the finance company pays the seller as soon as the goods are delivered, and get its money back when the bills are eventually paid by the customer.,Mr Greensill helped to convince the UK government to set up a supply chain finance scheme for pharmacies - paying them early for money they were owed by the NHS. In 2018, Greensill Capital won the contract to run it.  ,Mr Greensill turbocharged this unglamorous corner of finance by packaging and selling the debts to bigger investors.,In the process, he built a global company, at one point valued at $7bn (£5bn), with a fleet of four private jets.,Questions had been asked before about the sustainability of Greensill's business since at least 2018. ,But the final blow came last July when one of its insurance companies withdrew cover that protected some of Greensill's investors.,Liberty Steel, Britain's third-largest steel producer employing 3,000 people in England, Scotland and Wales, was receiving financial backing from Greensill. ,Its future is now in doubt. ,The relationship between those at the top of government and big business has never been under more scrutiny, following questions ,Critics argue that it is too easy for ministers and top civil servants to use their insider knowledge of Westminster to enrich themselves when they leave government. The danger is that decision-makers could have one eye on their next pay day, rather than the best interests of the country.,In 2010, Mr Cameron warned that the ""the far-too-cosy relationship between politics and money"" was ""the next big scandal waiting to happen"".,There is also a question of access. Who gets time with ministers to push their cause? ,There are thousands of lobbyists - from trade unions to environmental groups to multinational companies - why do some people appear to get favoured treatment?,Labour wants a full inquiry into how Mr Greensill was given access to the heart of government.,The Committee on Standards in Public Life has said it can't investigate individual cases, so it may fall to a select committee if it happens at all.",politics
https://www.bbc.com/news/uk-politics-56592361,Lisa Nandy: Foreign policy affects people at home,"Setting out Labour's approach to foreign policy, Lisa Nandy pointed to how the UK's actions abroad ""affects the lives of people at home"". ,Yet she said foreign policy was too often ""agreed in closed rooms"".,Ms Nandy said Labour wanted to address the ""growing disconnect"" and win back ""the support and consent"" of voters.,She also said a Labour government would make national security a top priority - including working with the EU and Nato to deal with Russian aggression - as well as enhancing environmental security by tackling climate change.,""I want to make the case today that the gulf between what we do abroad and what we choose to deliver for people at home is a direct threat to the security and prosperity of our country,"" she added.,In her first speech on foreign policy since being appointed to the role last year, Ms Nandy told the Chatham House event that ""the global and the local are one and the same"".,She added: ""The world beyond our shores, and our ability to mould and shape it, affects the lives of people at home to an extraordinary degree. ,""Why then, more than the economy, education, or health, is foreign policy so often discussed and agreed in closed rooms without reference to the people affected?"",Ms Nandy said people across the country, from steelworkers to football fans, had seen their lives affected by foreign policy decisions of the government. ,She accused the Conservatives of ""failing to defend the interests of people across our four nations"" - claiming the ""paper-thin"" Brexit agreement had damaged both the Welsh farming industry and turned the Good Friday Agreement into ""a bargaining chip"".,But she also said there had been a ""needlessly antagonistic approach pursued by both sides"" over Brexit, which had ""cost us all"".,The shadow foreign secretary also said Labour was a patriotic party. ,Ms Nandy said its approach would involve starting ""a new national conversation about our place in the world and the sort of country we want to be"".,She added: ""We can build an agenda for Britain that matches the ambition of the people in it - big and generous, not small and petty - measured not in the number of our flags but in the health of our children, the strength of our communities, the dignity of our workforce and the security of our nation.,""That will be the benchmark for the success of our foreign policy.""",politics
https://www.bbc.com/news/uk-politics-56590518,Councils filling potholes 'every 19 seconds',"The Asphalt Industry Alliance said this figure - , - equated to one being fixed every 19 seconds.,The total amount spent by local authorities on filling in potholes in 2020-1 was £93.6m, it added.,The government said it was working to ensure ""smoother, safer journeys"".,Potholes - collapsed areas in the tarmac resulting from the pressure of traffic and bad weather - can be dangerous to motorists and, in particular, cyclists.,The AA told the BBC last year that the pandemic, which has cut traffic levels, presented a ""unique opportunity"" for local authorities to fix more roads.,But, while the pothole-filling figure has risen this year, the Asphalt Industry Alliance's survey still suggests one million fewer were fixed than in 2014-15, when it went as high as 2.7 million.,It also found that the proportion of council-maintained roads in England deemed to be in a ""poor"" state fell from 21% in 2019-20 to 16% this year.,But in Wales it increased from 20% to 21%.,Main roads and motorways in England and Wales are maintained by Highways England and the Welsh Government respectively, while councils look after the upkeep of local, usually more minor, roads.,AA president Edmund King said many of these were still in a ""perilous state"" and that users had to ""run the gauntlet of potholes once they turn into their neighbourhoods"".,He added: ""Government and councils urging more active travel by getting people to switch from car to bicycle doesn't sit right with local roads riddled with potentially lethal potholes."",The Local Government Association, which represents councils in England, has called for £10bn to be spent to bring roads ""up to scratch"".,Nicholas Lyes, head of roads policy at the RAC, said local authorities were ""grappling with crumbling road surfaces"" and called for a more ""long-term approach"" to funding.,But a Department for Transport spokesperson said: ""This government is providing £2.5bn in funding over five years to help councils improve their roads, to ensure all road users have smoother, safer journeys."",The government has published daily figures on road use by motorised vehicles in Great Britain since the beginning of the pandemic last year.,They dipped as low as 23% of the usual level during the first lockdown but are currently at about 80%.",politics
https://www.bbc.com/news/uk-politics-56583153,Sobriety ankle tags' rolled out across England,"The ""sobriety tags"" monitor a wearer's sweat levels every 30 minutes, and alert probation services if alcohol is detected.,Offenders breaching their abstinence order can then be returned to court to face further sanctions.,The scheme has been in operation across Wales since October. ,The government said more than 100 people have been tagged there since then, with offenders staying sober on over 95% of days monitored.,The rollout across England was meant to begin in late 2020, but has been delayed.,Under the scheme, courts will be able to hand out ""alcohol abstinence orders"" to offenders who commit crimes fuelled by alcohol.,These can require the offender to abstain from alcohol for up to four months and wear the electronic tag to monitor compliance. ,Policing and Crime Minister Kit Malthouse said the tags were a ""powerful new tool"" to combat alcohol-fuelled violence and help steer offenders away from ""bad habits"". ,The tags can only be used with offenders over the age of 18, who are not dependent on alcohol or have certain medical conditions. ,The government says the tags can distinguish the difference between drinks and other types of alcohol - such as in hand sanitiser or perfume.,The scheme has already been trialled in Humberside, Lincolnshire, North Yorkshire and London.",politics
https://www.bbc.com/news/uk-politics-56587671,English local elections: UK needs 'a green recovery' says Greens co-leader,"Mr Bartley said people ""desperately need hope"" after an ""incredibly tough year"". ,He said his party would campaign in England for more green jobs, affordable public transport and warmer homes.,The Green Party of England and Wales currently runs, in coalition with other parties, 17 councils. ,Local elections will take place on 6 May for councils, mayors, police and crime commissioners in England and the Scottish and Welsh Parliaments. ,Launching his party's campaign in Battersea Park, south London, Mr Bartley said the country need a ""recovery from this pandemic that doesn't take us back to business as usual"".,He argued that a green recovery was ""not about having less but is about having so much more"".,""We're ready for millions of new jobs, in green jobs, in industries that aren't threatening our future; we're ready for homes that are warmer and cheaper to run, within minutes of the services we need; we're ready for a public transport system that is efficient affordable and not based on profit."",He said the coronavirus lockdown had ""put the spotlight on what we really value - the people we love, our communities, security, our access to nature and green spaces"".,He added that ""a green future is not a pipe dream - it is within our grasp."",In an interview following the launch, Mr Bartley said the pandemic had proved it was possible to do things differently.,""We realised we could take cars off the road; we could pay people's wages; business, if they were supported properly could transition and operate in different ways."",Mr Bartley - who co-leads the party with Sian Berry - said he was hopeful of building on the Green Party's electoral success in 2019 when the party gained almost 200 councillors.,The party's biggest gain came in Brighton and Hove where it won eight additional councillors. However it lost seats in Bath, North East Somerset and Cambridge.,Overall the Green Party came in fourth place behind the Conservatives, Labour and the Liberal Democrats, winning 12.1% of the vote. ",politics
https://www.bbc.com/news/uk-politics-56587669,Covid: Ministers urged to help tenants and landlords with rent arrears,"The housing committee warned that ministers are in danger of breaking their pledge that nobody should lose their home as a result of the pandemic. ,It also said the government's efforts to take all rough sleepers off the streets are now effectively over.,The government said this claim was misleading.,A spokesman said the government spent over £700m this year and £750m next year on tackling homelessness and rough sleeping.,A Resolution Foundation report produced last month , almost half a million families had fallen behind on rent as a result of the coronavirus crisis.,A ban on landlords in England evicting tenants, introduced during the pandemic, has been extended several times and is currently due to expire at the end of May. ,Ministers have suggested there will be no more extensions and that from June the government would introduce a ""new approach"".,The Housing, Communities and Local Government Committee said many renters would be at risk of becoming homeless when the evictions ban ends.,It added that this problem would be exacerbated by rising unemployment as government support schemes taper off.,To prevent a rise in homelessness, MPs said the government should provide specific targeted support to tenants to repay rent arrears built up over the last year.,They estimated this would cost between £200m and £300m and would reduce expenditure on homelessness assistance in the longer term.,A spokesman also said it had given renters ""robust protection"" during the pandemic, ""with longer notice periods of six months and banning bailiff enforcement of evictions for all but the most serious cases until 31 May"".,Welcoming the committee's report, the National Residential Landlords association said it highlighted a ""lack of a clear strategy from the government"".,Its chief executive Ben Beadle said there needs to be ""action to tackle rent debts built as a result of the pandemic"".,""Making direct payment to landlords"" would be ""the best way to sustain tenancies and help landlords receive income"", he said.,The committee praised the ""enormous success"" of the initial stages of the Everyone In Scheme which sought to house rough sleepers during the pandemic.,The scheme helped more than 37,000 people into accommodation and University College London has estimated that as of December 2020, it had prevented 242 deaths.,However, the MPs said a change in government policy in May 2020 meant some people were being left out.,Initially, ministers had encouraged local authorities to help those who had No Recourse to Public Funds (NRPF) - people whose temporary immigration status means they cannot access most financial state support.,But councils were later told they should use their judgement when deciding whether to help those with NRPF.,The committee said this led to confusion and saw many denied support.,""Everyone In by definition has finished as it is no longer helping all those in need of accommodation,"" said committee chair Clive Betts.,The High Court recently ruled that councils should help house people with NRPF during the pandemic - and the committee urged ministers to reflect this in their guidance to local authorities.,Chief executive of homeless charity Crisis, Jon Sparkes said: ""There is no doubt that government action to protect those facing, and at risk of, homelessness during the pandemic transformed lives and prevented many people from destitution.,""The report highlights the need to look beyond the emergency response to achieve lasting change and real progress towards ending homelessness."",Mr Sparkes said there should be an emphasis on ""preventing homelessness before it happens. Addressing the poor supply of social homes and a financial support package for renters in arrears due to the pandemic must be an integral part of this."",Responding to the report, the government said: ""Everyone In is still ongoing and for the committee to suggest otherwise is misleading.,""We are also working with partners to learn any lessons from the pandemic and as part of our ambitious plans to end rough sleeping for good.""",politics
