page,title,article,category
https://www.bbc.com/news/business-56559073,The cost of the Suez Canal blockage,"Peter Berdowski, chief executive of Dutch salvage company Boskalis, said ,, ""thereby making free passage through the Suez Canal possible again"".,However, it is not clear yet when full traffic in the canal can resume.,The blockage has been the source of much worry and frustration for the global shipping industry.,We take a look at the key numbers that have been involved in the operation.,The Ever Given is 400m-long (1,312ft) and weighs 200,000 tonnes, with a maximum capacity of 20,000 containers. It is currently carrying 18,300 containers.,The ship is operated by Taiwanese transport company Evergreen Marine and is one of the world's largest container vessels.,It became stranded on Tuesday, after running aground and becoming lodged sideways across the waterway. At first ,. ,The wind speed at the time was recorded at 40 knots, but the Suez Canal Authority (SCA) told reporters that this was not the only reason for the ship becoming stranded.,An investigation would be needed to determine whether technical or human errors occurred, the authority added. ,As of Sunday, there were 369 ships stuck in a tailback waiting to pass through the 193km (120-mile) canal on either side of the blockage.,Meanwhile, there have been more than 145,200 social interactions on Twitter using the  , hashtag and at least 133,000 shares, according to real-time analysis by brand monitoring platform BrandMentions. ,Over the weekend, 14 tugboats pulled and pushed the Ever Given at high tide to try to dislodge it and were able to move the ship ""30 degrees from left and right"".,​Then on Monday morning, after several reports that the ship had been partially refloated, the Suez Canal Authority (SCA) issued a statement saying that the Ever Given had been ""successfully refloated"".,The SCA said it would resume manoeuvres later on Monday high tide, ""allowing for the full restoration of the vessel's direction so it is positioned in the middle of the navigable waterway"".,Then at 13:05 GMT the Ever Given was finally fully freed.,However, it could take a while to clear the backlog of ships waiting to use the canal.,Richard Mead, managing editor of shipping journal Lloyd's List, told the BBC's Today Programme:  ""We're looking at about 450 ships still waiting to transit the canal. It's going to be a lengthy process clearing that backlog."",About 12% of global trade, around one million barrels of oil and roughly 8% of liquefied natural gas pass through the canal each day.,SCA chairman Osama Rabie on Saturday that the Canal's revenues were taking a $14m-$15m (£10.2m-£10.9m) hit for each day of the blockage.,Prior to the pandemic, trade passing through the Suez Canal contributed to 2% of Egypt's GDP, according to Moody's.,Separately, data from Lloyd's List showed the stranded ship was , along the waterway each day. That equates to $400m and 3.3 million tonnes of cargo an hour, or  $6.7m a minute.,Looking at the bigger picture, German insurer Allianz said on Friday its analysis showed the blockage could cost global trade between $6bn to $10bn a week and reduce annual trade growth by 0.2 to 0.4 percentage points.,Shipping broker Braemar ACM told the , that the cost of renting some vessels to ship cargo to and from Asia and the Middle East had jumped 47% to $2.2m. ,Some vessels have been rerouted to avoid the Suez Canal. That is adding around eight days to their total journeys.,The Suez Canal blockage doesn't just affect the global shipping industry or the Egyptian economy - countless businesses, from domestic transport providers to retailers, supermarkets and manufacturers are also impacted.,The true damage and cost is difficult to evaluate until the ship is fully freed and trade resumes., that they were still waiting to find out when goods were likely to arrive.,One UK company, Seaport Freight Services, said it had 20 containers of goods stranded on the Ever Given,""We're waiting on food goods like coconut milk and syrups, some spare parts for motors, we've got some fork lift trucks, some Amazon goods on there, all sorts,"" the company said.,There were concerns that if the blockage at the Suez Canal continued, some firms will have to pay to order more goods and have them sent over by air freight, which costs at least three times more. ",business
https://www.bbc.com/news/business-56565635,Finding work feels impossible for my generation',"The creative professional from Great Yarmouth, 20, left a job just before the pandemic began and has only worked for a month at her local theatre since.,According to new research from the Prince's Trust, people under 25 account for three in five of the jobs lost during the crisis so far. ,And it warns youth unemployment could rise even higher.,The problem, it says, is that younger workers are over-represented in sectors hit hardest by the pandemic, such as hospitality and entertainment, and these will take longer to recover.,They are also under-represented in occupations likely to see the strongest job growth coming out of the crisis, such as health and social work.,Ms Burrell says she had job application after job application rejected last year - the NHS was the only employer hiring locally and she didn't have the right skill set. ,She finally found work at a community theatre in December, before the UK went into lockdown again, but while the theatre hopes to take her back in May, there is no guarantee.,""Because I want to work in the creative industries, there's almost nothing out there - the industry has been hit so hard,"" she tells the BBC.,""And as someone who doesn't have a lot of experience, it makes it doubly hard. A lot of jobs require experience, but how are you supposed to get experience if it isn't given to you?"",There are signs the wider jobs market is stabilising, with the unemployment rate dipping , down from 5.1% before. ,But the number of workers on company payrolls was still 693,000 lower in February than it was a year earlier, with under-25s accounting for about two thirds of the fall.,The Prince's Trust says long term ""structural changes in the labour market"" will make it harder for young workers to bounce back as the economy reopens. ,And it expects the lost earnings and damaged employment prospects to cost those jobseekers as much as £14.4bn over the next seven years. ,Matthew Gilbert, 22, graduated from Reading University last year and has been job seeking for over a year. ,""It has caused a lot of stress. It has made me feel like I don't have a direction and it is slowly grinding down my confidence,"" says Mr Gilbert, who lives with his parents on London.  ,He is looking for work in what he studied - ecology and wildlife preservation - but he says a large number of candidates are chasing a tiny number of jobs. He has only been asked to about four interviews since last March. ,Like others, he has faced issues with mental health and anxiety during the pandemic, but he tries to stay optimistic. ,""I am hopeful things will start rebounding, but we have to wait and see."",Another risk, the Prince's Trust says, is that pre-existing inequalities could worsen if youth unemployment remains high for a long time. ,It says the decline in working hours for young people with no qualifications - at 34% - has been five times higher than the decline for those with a degree level qualification.,Meanwhile, the decline in hours worked by young black people - at 49% - has been three times higher than for young white people.,Jonathan Townsend, head of The Prince's Trust, says the events of the last year have ""added barriers that can seem insurmountable"" for young people entering the jobs market. ,He says government schemes had helped, but there was ""much more to do"".,""Failing to take action risks not only harming young people's futures, but the future of our economy as a whole."",The Department of Work and Pensions says it has been offering a range of support, including more money for traineeships, a type of work placement, and better incentives for employers to take on apprentices.,A spokesman says: ""We are helping young people fight back from this pandemic by creating fresh opportunity fast. ,""We have a Youth Offer in place which includes access to support from our Youth Hubs and Kickstart, which has already created 150,000 approved job placements. ,""And through Skills Bootcamps, the Lifetime Skills Guarantee, more apprenticeships and more traineeships we are helping young people get the skills they need as we build back better.""   ,Please include a contact number if you are willing to speak to a BBC journalist. You can also get in touch in the following ways:",business
https://www.bbc.com/news/business-56564717,Credit Suisse and Nomura warn of hedge fund hit to profits,"Switzerland's second-biggest bank Credit Suisse said it could have a ""highly significant"" impact on its next quarterly results.,Japan's Nomura said it could make a $2bn (£1.4bn) loss from a US client.,Both have been hit by problems at hedge fund Archegos, which led to the sale of billions of pounds of shares on Friday.,Hedge funds make money buying and selling shares. It is thought that Archegos made some large investments in certain companies that started to go wrong, and its backers then insisted it raise money in a hurry, in what is known as a margin call, prompting some unusually large share sales.,A margin call is when a bank asks a client to put up more funds if a trade partly funded with borrowed money has dropped steeply. ,If they can't afford to do that, the lender will sell the shares to try to recover what it is owed.,Companies caught up in the selling spree include big names such as ViacomCBS, Discovery, Tencent, Baidu, and UK online retailer Farfetch.  ,Investors in both banks have been rattled, Credit Suisse shares are down 14% and Nomura's closed down 16% on the Japanese stock market. ,Fears over who else might be affected by the matter has prompted falls in the shares of other banks, including Deutsche Bank and Goldman Sachs, although by far smaller amounts.,Credit Suisse's fortunes are already facing a hit from its lending to Greensill Capital, the finance firm whose collapse has put at risk the future of the UK's Liberty Steel.,, Credit Suisse said: ""A significant US-based hedge fund defaulted on margin calls made last week by Credit Suisse and certain other banks. ,""Following the failure of the fund to meet these margin commitments, Credit Suisse and a number of other banks are in the process of exiting these positions.,""While at this time it is premature to quantify the exact size of the loss resulting from this exit, it could be highly significant and material to our first quarter results."",Neither named Archegos Capital Management, which, although not a household name, is a big player in US markets. ,It is the family investment firm of Bill Hwang, who was banned in 2014 from trading in Hong Kong, and in 2012 settled insider trading charges in the US.,The surprise default of a US hedge fund will send shivers through world stock markets. Traders will inevitably recall the demise two decades ago of Long Term Capital Management, a hedge fund that was one of the darlings of Wall Street only to collapse in the late 1990s. So big and complicated was its trading book that a bailout had to be organised among the US financial industry's biggest players, but before they stepped in there was a period of horrible uncertainty over whether the fund's demise might cause a large market crash.,At first sight Archegos does not look to be another LTCM - it is much smaller, and it appears to have been managing the money only of its founder and traders rather than for external investors. But one of the lessons of the 2008 crash is that the financial world is deeply interconnected, and it is difficult to gauge exactly what risks and trading positions individual hedge funds have built up. ,One of the curiosities of Archegos's default is that it was set up by Bill Hwang, a trader with a chequered past - he was banned from the Hong Kong market in 2014. Why banks like Credit Suisse and Nomura chose to have substantial business with his firm will be a subject of great interest to both institutions' senior management and shareholders.",business
https://www.bbc.com/sport/av/football/56544099,Match of the Day Top 10: Why Micah Richards won't have Roy Keane as football's hardest man,"In the latest Match of the Day Top 10 podcast, Micah Richards tells Gary Lineker and Alan Shearer why former Manchester United captain Roy Keane ""let him down"" when it comes to being considered football's hardest man.",sports
https://www.bbc.com/sport/av/football/56572012,Thierry Henry: Former striker speaks to BBC Newsnight about online abuse,"Former France and Arsenal striker Thierry Henry tells BBC Newsnight about his decision to remove himself from social media, saying that ""it is time to take a stand and make people realise that it's not OK to get abused online"".",sports
https://www.bbc.com/sport/av/formula1/56501611,Fernando Alonso: Two-time world champion is back racing in Formula 1,"Two-time Formula 1 world champion Fernando Alonso speaks to BBC Sport's Ben Croucher about being back in F1 after two years racing in other categories, driving for the Alpine team, formerly Renault.,He says he ""feels lucky"" after a cycling accident earlier this year, and insists he is ""better"" than the biggest names on the grid.",sports
https://www.bbc.com/sport/av/football/56546240,England's Declan Rice says spectators at Euro 2020 would put 'fire in the stomach',"England midfielder Declan Rice tells Football Focus' Kelly Somers that playing in front of fans at Wembley at the delayed Euro 2020 would put ""fire in the stomachs"" of the players. ",sports
https://www.bbc.com/sport/av/boxing/56536759,"Whyte v Povetkin: Rematch will definitely be different result this time, says Dillian Whyte","British heavyweight Dillian Whyte tells BBC boxing correspondent Mike Costello that Saturday's , will ""definitely be a different result"". In August, Whyte - on the verge of a first world-title shot - was ,.",sports
https://www.bbc.com/sport/rowing,Rowing,,sports
https://www.bbc.com/sport/av/hockey/54960023,Rani: 'We represent a billion people when we play',"Rani is India captain and considered among the best women players in the world. ,Her goal against the United States in November 2019 played a pivotal role in securing a berth for the team at the Tokyo Olympics.,The BBC Indian Sportswoman of the Year nominee speaks of her pride at representing over a billion Indians as they aim to bring home an Olympic medal.",sports
https://www.bbc.com/sport/av/wrestling/54960022,Vinesh Phogat: I was told to cover my legs at training,"Indian wrestler Vinesh Phogat has won medals at the World Championships, Commonwealth Games and Asian Games - she is one of the most decorated wrestlers in her country.,Belonging to a family of international female wrestlers, the 26-year-old describes how she faced sexist remarks growing up and overcame gender stereotypes to forge a successful career as a professional athlete.",sports
https://www.bbc.com/sport/av/shooting/54960019,Manu Bhaker: The teenage shooting sensation,"Aged just 18, shooter Manu Bhaker is one of India's brightest medal prospects for the Tokyo Olympics.,Bhaker won 10m air pistol gold at the Shooting World Cup in 2018, becoming the youngest Indian to do so. She already has Youth Olympic, Commonwealth and World Cup golds to her name.,The BBC Indian Sportswoman of the Year nominee jokes she has forgotten how many medals she has already won.",sports
https://www.bbc.com/sport/av/54960021,The female chess grandmaster who relishes beating men,"Koneru Humpy is one of the most talented Indians to grace the chess board.,The 33-year-old was identified as a chess prodigy at an early age by her father. She lived up to the reputation by becoming the youngest ever female grandmaster shortly after turning 15 in 2002.,The current women's World Rapid Chess champion and BBC Indian Sportswoman of the Year nominee says she savours her victories over male opponents more than those against woman.",sports
https://www.bbc.com/sport/av/athletics/54960020,"Dutee Chand: 'I train six times a day, I have to win'","Dutee Chand is one of South Asia's fastest sprinters. The 25-year-old national 100m champion is India's first openly gay athlete and has risen from a humble background to become one of her nation's most promising sportswomen.,Here, she describes how she endured sleeping on train platforms, allegations of elevated hormone levels and her gruelling training schedule.",sports
https://www.bbc.com/sport/wrestling,Wrestling,,sports
https://www.bbc.com/sport/hockey,Hockey,,sports
https://www.bbc.com/sport/shooting,Shooting,,sports
https://www.bbc.com/news/av/world-asia-india-56080312,Priyanka Dewan: The roller-skating star who beat disability stigma,"Priyanka Dewan was just eight years old when she picked up a pair of roller skates at her mother's suggestion. ,What started out as a hobby soon turned into a passion and the 20-year-old is now an international roller-skating champion. ,This video is part of the ,. , to know more about the nominees and vote for your favourite athletes. ",sports
https://www.bbc.com/news/entertainment-arts-56587791,Amy Winehouse's mum Janis makes documentary 'to save memories from MS',"The BBC said a large part of Janis Winehouse's motivation for taking part in the film was because Multiple Sclerosis ""threatens to strip her of her memories of Amy"".,Janis was diagnosed in 2003 and memory problems are common with MS.,""I don't feel the world knew the true Amy, the one I brought up,"" she said.,""I'm looking forward to the opportunity to offer an understanding of her roots and a deeper insight into the real Amy."",The singer, whose 2006 album Back To Black established her as one of the greatest talents of her generation, died from alcohol poisoning at the age of 27 in July 2011.,The BBC said her story would be told in the new documentary ""primarily through her mum"", whose version of events ""often differs from the narrative we have been told before"".,Janis will be joined by family and friends, and the film will offer ""a new female-driven interpretation of her life, her loves and her legacy"", the announcement said.,In her 2014 book Loving Amy: A Mother's Story, Janis wrote that a gradual ""loss of sharpness"" of memory was part of MS. ""I worry about the day when Amy stops being alive in my head and in my heart. I don't want that day ever to come,"" she wrote.,Janis had been experiencing symptoms of MS for more than 20 years before being formally diagnosed. She became an ambassador for the MS Society in 2019.,Amy's childhood friend Juliette Ashby told BBC Breakfast on Wednesday: ""I think it's a lovely, wonderful thing her mum's doing for her."",Ashby remembered Amy as ""a force to be reckoned with"" and ""one of the kind"", adding: ""Genuinely there is no one like her. And there won't ever be anyone like her."",The documentary, which has the working title Amy Winehouse: 10 Years On, is not the first to be made about the singer.,A 2015 film titled Amy, made by director Asif Kapadia, won the Oscar for best documentary, although , that it was unbalanced and ""tainted"".,The anniversary will also be marked with the release of a three-CD compilation of Winehouse's performances at the BBC.,And there will be other special programmes, including a BBC Radio 2 documentary about her influence on younger female singer-songwriters and a Radio 1 documentary to introduce her to a new generation of listeners.",arts_culture
https://www.bbc.com/news/entertainment-arts-56587621,Hit songwriters ask pop stars to stop taking credit for songs they didn't write,", the writers behind songs like Dua Lipa's New Rules and Ariana Grande's 7 Rings said ""a growing number of artists"" were demanding a share of publishing royalties, even if they had contributed nothing to a song.,""These artists will go on to collect revenue from touring, merchandise [and] brand partnerships,"" they said, but ""songwriters have only their publishing revenue as a means of income"".,They added that composers were often subjected to ""bully tactics and threats"" by artists and executives who wanted to take a share of the songwriting royalties.,The letter was organised by a new advocacy group calling itself The Pact. Signatories included Justin Tranter, Emily Warren, Ross Golan, Amy Allen, Savan Kotecha, Joel Little and Victoria Monét.,Between them, they have created hit records for the likes of  Lady Gaga, Britney Spears, One Direction, Michael Bublé, Lorde, Shawn Mendes and Selena Gomez - although the letter was not directed at any specific artists.,""Over time, this practice of artists taking publishing has become normalised; and until now, there has been no real unity within the songwriting community to fight back,"" they wrote.,""That is why we have decided to join together, in support of each other, and make a change."" ,The letter addresses a music industry practice that dates back to Elvis Presley, whose manager Colonel Tom Parker often insisted on his client receiving a co-writing credit on the songs he recorded. ,Many composers acquiesced, using the logic that the money earned from 50% of an Elvis record would be higher than 100% of the same song, recorded by a less well-known artist.,Over time, the idea became so commonplace that it spawned a phrase: ""Change a word, get a third"" (as in, one slight tweak to the lyrics can get you a third of the royalties).,Until now, writers have been reluctant to speak publicly about the issue, in case it harms their careers.  ,The Pact's letter arrives at a time when songwriters' earnings are increasingly under the spotlight. ,MPs investigating the economics of music streaming were recently told that composers' were being forced to take second jobs because they couldn't make ends meet.,Speaking to the DCMS Select Committee, Fiona Bevan, who has written songs for One Direction and Lewis Capaldi, revealed she had earned just £100 for co-writing a track on Kylie Minogue's number one album, Disco.,""The most successful songwriters in the world can't pay their rent,"" she said. ""Right now, hit songwriters are driving Ubers. It's quite shameful."",In the US, streaming services like Amazon and Spotify , for songwriters and publishers whose work is featured on their services.,Emily Warren, whose credits include Dua Lipa's Don't Start Now and Little Mix's No More Sad Songs, is said to be behind organising the open letter, which was published on Tuesday.,""Emily is the one that has really led the charge here so this moment can actually happen,"" ,.,Tranter said he had signed the pledge in the hope that ""new songwriters can operate with a little less fear and little more money"". ,He added that he didn't want the campaign to be turned into ""gossip nonsense"" by people looking for artists taking credit they didn't deserve.,""I have worked with and written with some UNREAL artists who let me into their lives to create with them who deserved their credit and publishing, so please leave the BS out of this,"" ,.,""We are simply asking that we give credit where credit is due and only take credit where credit is earned,"" ,, who has worked with Lewis Capaldi and Little Mix.,""If we take the song out of the music industry, there is no music industry,"" the open letter concluded. ,""As of today, we will no longer accept being treated like we are at the bottom of the totem pole, or be bullied into thinking that we should be making sacrifices to sit at the table. We are all in this together, and we all need each other for this wheel to keep turning. So let's start acting like it.""",arts_culture
https://www.bbc.com/news/newsbeat-56588276,Real Housewives star Jen Shah charged over 'US-wide' fraud scheme,"The TV star, 47, and her assistant Stuart Smith, 43, have been charged with conspiracy to commit fraud and money laundering, , said.,They were arrested and appeared in Salt Lake City federal court on Tuesday.,It's alleged they have been running a US-wide fraud scheme since 2012.,According to prosecutors, Ms Shah and Mr Smith sold services - such as website design - which claimed to make the management of victims' businesses more efficient or profitable. ,They're also alleged to have offered to sell the personal information of potential victims to other members of the ""fraud ring"".,Manhattan US Attorney Audrey Strauss said Ms Shah portrays herself ""as a wealthy and successful businessperson on reality television"". ,""In actual reality and as alleged, the so-called business opportunities pushed on the victims by Shah, Smith, and their co-conspirators were just fraudulent schemes, motivated by greed, to steal victims' money,"" she said.,Many of the alleged victims are over the age of 55.,The charge of conspiracy to commit wire fraud in connection with telemarketing carries a maximum sentence of 30 years. Conspiracy to commit money laundering carries a maximum sentence of 20 years.,Jennifer Shah is part of the main cast of the show, which airs on Bravo. The first season ended in February and the show has been renewed for a second season.,Newsbeat has contacted the show and Ms Shah's representatives for comment, but they are yet to respond. Bravo said it would not comment on the allegations.,. ",arts_culture
