page,title,article
https://www.newtimes.co.rw/sports/ferwafa-sets-tough-penalties-violation-covid-19-guidelines,"Ferwafa sets tough penalties for violation of Covid-19 guidelines
","The national football governing body, Ferwafa has issued tough sanctions for teams that will violate Covid-19 guidelines ahead of the league resumption.,There are reports that the Rwanda Premier League will resume after the commemoration of the 1994 genocide against the Tutsi. The commemoration week starts on April 7 and ends on April 13.,On Monday, FERWAFA released a document that set new tough penalties and fines for teams that will violate the new Covid-19 guidelines.,FERWAFA will pay for the Covid-19 Rapid Test for 40 people per club and both the players and non-playing staff will be required to stay in camp after matches.,Teams that fail to take covid-19 tests will have their matches canceled and the opposing team will be given a 2-0 win, while the match the commissioner will be suspended for five (5) years.,Before returning to camp, each team will inform the FERWAFA where they will hold training sessions and Ferwafa will visit those sites to ensure that the venue has all the facilities needed to prevent the spread of Covid-19.,The League was suspended by the Ministry of Sports on December 12, after three match days when some teams failed to comply with Covid-19 guidelines, with some faking results of Covid-19 tests.,Football clubs are also required to test their players again after five days from the time the players go into residential camp. Clubs will also cater for the testing of staff who exceed the threshold that Ferwafa will cater for.,Delay in delivering results of the covid-19 Rapid test for the match-day and not using a van designated to transport the team from training and match days will attract a fine of Rwf200, 000.,Any player or official caught leaving the residential camp will be fined Rwf500,000 and banned for two matches.,Any team that violates all the regulations will be banned from any football activities for a year.,Covid-19 tests for players and officials will take place on match days at the stadium where the match will be played and the results will be given to a FERWAFA representative at least 3 hours before the start of the match.,Meanwhile, Ferwafa has changed the substitution rule for this season and will allow five substitutions, however, each team is allowed to substitute no more than 3 times during the game except when the team chooses to substitute during half-time.,Prior to the suspension of the Premier League, after four matches played, Marines was top of the league table with 7 points, followed by Musanze with 6 points. Etincelles is third with 4 points while Gasogi is fourth with 3 points."
https://www.newtimes.co.rw/business/solar-electricity-changing-lives-testimonials-remote-villages-rwanda,"Solar electricity is changing lives, testimonials from remote villages in
Rwanda
","Mukande, a 31-year-old woman from a remote village in Gisagara District is sweeping the ground outside her home while talking to one of Ignite’s on-field agents. Her husband is out in the field, working on their maize crops.,Her 11-year-old son is standing close by, next to one of the family’s cows, while her younger daughters are running around the yard. “Having light in our home completely changed our lives”, she exclaims. “The kids can now do their homework after dark, and I can cook whenever I want to”.,Mukande and her family have had access to solar-based electricity in their home for the past year. “Now with the lights, we sleep much better. We used to sleep with the cows before, because it wasn’t safe to leave them outside due to the many thefts going on after dark. Now, thanks to the light we keep them outside, and everybody has more room to sleep comfortably,”Mukande points out “,Mukande’s story is a depiction of millions across Africa, who have been connected to electricity in recent years through off-grid solar solutions., During the final months of 2020, Ignite’s employees canvased various villages across Rwanda’s rural communities, gathering some meaningful testimonials about life before, and after gaining access to power. And the changes are undoubtedly monumental.,Across the continent, the number of people gaining access to electricity doubled from 9 million a year between 2000 and 2013 to 20 million people between 2014 and 2019, with Kenya, Senegal, Ghana, Ethiopia, and Rwanda playing the main role in the revolution. In Rwanda, the access rate rose from 9.7 per cent in 2010 over 34 per cent in 2020, to almost 85 per cent in 2019. As numbers of connections per year grew, so did the role of solar off-grid systems, reaching more than 25% by 2019.,But alongside vast improvements and development, Africa’s population growth rate is outpacing the rate of electricity connections, and Covid-19 is already affecting electrification efforts, as global and local budgets are directed to fighting the pandemic. While billions of dollars go to vaccination efforts, and other pandemic-related, necessary affairs, it is important to remember that unlike other countries that can put all their efforts into the Covid fight, Africa has other crucial needs that must be addressed. Electricity access is a leading necessity, vastly influential on multiple elements of everyday lives, and leading to ample development across the continent.,“Before having light we used petrol and risked burning the house”, says Celestine, 45, who lives with her husband and their 2 children in a village in the Gisagara district. “Now we feel much safer.”,Throughout the rural areas of Sub Saharan Africa, petrol and other combustible fuels are used for lighting, cooking, and heating purposes, which are often done through indoor open fires. The fire and smoke contribute to high mortality and disease rates, as homes can be easily burnt to the ground, and smoke causes various diseases including pneumonia, lung cancer. Across the region about 1 million mortalities a year are caused by smoke-related health issues.,The problem is not only in the household. About 730 million tons of biomass are burned for fuel each year in developing countries, releasing as much as 1 billion tons CO2 into the atmosphere. In addition open fires emit high concentrations of a number of black carbon and methane, both with significant climate consequences.,Having home electricity also provides various opportunities for increasing household income. “Before having lights, we used to bring maize to clean, and had to finish before nightfall, and now we can continue after dark.” Mukande explains.,“Before having the solar system we used to sell 30 kg of maize, now we are selling 60”.,Across the SSA, over 52% of the working population is in the agriculture field. But albeit a source of employment for over half of the continent’s population, the sector contributes only 23% of the GDP, due to poor irrigation, rotting crops, and insufficient national funding. This contributes to food insecurity which is a major concern for the continent, even more so now during the Covid period. To that end, upping crop sales by 50% is that more meaningful.,Education has been a sore spot for people all over the world since Covid began. In the western hemisphere, millions of children have been studying from home, via different online platforms. But across remote communities in the SSA region, such platforms are not really an option. School closures in the region sent around 250 million children home, and learning completely stopped for most of them, with many likely to never return to class. Having home electricity is meaningful for the long term, as it may enable access to online schooling. But even the light alone makes a meaningful difference. “Before we had light, the children didn’t have time to do their homework. They were at school until 5:30pm and then did house chores,” says Nyirarukundo, 43 from Kivomo.,“Now kids are studying and getting good grades at school”. And it is not just the kids that put in more effort into their education. “My 27 year old son is studying! And showing interest! His sister, 15 years old, is also doing much better in school. Their knowledge increased”, Mukamparaye, 57, from Kivomo exclaimed excitedly.,Despite the immense progress throughout the past decade, more than 600 million people across Africa are still living without electricity access, and these numbers are expected to increase due to population growth and the Covid pandemic. For us who take electricity and its various effects for granted, it is crucial to take a look at some of these testimonials, portraying the change that electricity has, on the smallest, and largest scales. As we redefine global priorities during these turbulent times, it is important to remember that basic infrastructure such as running water and electricity play an essential role in human development, and should not be left behind."
https://www.newtimes.co.rw/business/mtn-considers-setting-financial-tech-firm,"MTN considers setting up financial tech firm
","MTN Rwanda is considering setting up an independent company to take on and operate its financial technology operations.,The development is an attempt by the telecom operator to increase relevance to financial technology which is increasingly characterizing the financial industry in aspects such as inclusion., said that with financial technology fast becoming influential in digital finance, they have been considering setting up an independent subsidiary running financial technology operations.,This would see Mobile Money move from a department within the telecom to a stand-alone company.,“Mobile Money was initially set up as a department within MTN Rwanda. Where we stand today, we see the future of digital finance, Fin-tech so much bigger than what we are today,” she said.,She said that they had already commenced engagement with the regulator, Central Bank, to establish the requirements and characteristics of the new firm.,She, however, said that the timelines for the establishment and constitution of the new firm are yet to be determined.,The new firm, she said, is expected to be agile to trends in fin-tech hence the autonomous structure.,This comes at a time when Fin-tech is expected to be a key driver in driving financial inclusion, fostering savings, access to short-term credit among others.,With increased mobile penetration and usage, the avenue could bridge a gap in access to financial services which financial sector operators such as banks have been unable to bridge.,In 2020, MTN Rwanda saw a significant uptake of their Mobile Money and data services with initial estimates pointing to a 20 per cent (year on year)growth in revenue.,Though audited financials are not out yet, Mark Nkurunziza, the operator’s Chief Financial Officer, said that they have noted a shift in revenue composition with data and Mobile Money increasingly raking in significant portions of revenue.,Chantal Kagame, the firm’s Chief Business and Corporate Affairs Officer, noted that during the course of 2020, the active mobile money user base had grown from 2.8 million to 3.2 million while MoMo Pay users had increased from about 200,000 to about 1.4 million.,This, she noted was indicative of progress in uptake of cashless payments within the economy.,“We currently have more than 2.4 million customers using MoKash both by saving and taking loans. These are mainly by low-income earners where the service has helped them to save, take loans and develop their lives in general,” she added.,However, with the increased uptake and usage,, there has been an increase of fraud which the firm said is constantly working to curb including,MTN is also expected to list on the , allowing Rwandans to invest and partake in its returns.,The development will see the 20 per cent stake held by Crystal Telecom Limited held directly by the public., While 100 per cent shares of MTN Rwanda will be listed on the stock exchange, the 20 per cent stake held by , will be available for trading by the public. MTN Group will hold the 80 per cent shares.,The Board of Crystal Telecom has recommended that the shareholders of , Rwanda when the listing happens through a transaction where CTL shall repurchase all its shares from its shareholders in exchange for MTN Rwanda shares as consideration (share swap).,The board has proposed that when MTN Rwanda lists, the share swap will be on a 1:1 ratio basis, with each shareholder receiving 1 MTN Rwanda share for every share repurchased by the CTL.,The share swap and the approval, therefore, shall be conditional upon the successful listing of MTN Rwanda on the RSE, an announcement by the Board mentioned.,CTL is also expected to wrap up operations and close the shop thereafter."
https://www.newtimes.co.rw/business/mission-oriented-post-covid-transformation,"Mission-oriented post-Covid transformation
","Although Rwanda was growing at a fast pace and transforming itself into a beacon of excellence for the continent, the pandemic will definitely leave a set of scars behind. The crisis we are experiencing has a triple face: a grave economic situation, accompanied by an increasingly urgent climate catastrophe, and exacerbated by a health emergency.,Our recovery must therefore have the direction of inclusive smart growth: more innovation, more well-being and more sustainability. This is essential to rethinking the direction of growth and also the way in which public and private interact, in order to ensure a long-term sustainable path. The objectives of sustainability and inclusion must cut across this entire transformation and must emerge from a process of consultation and discussion with institutional actors, but above all with citizens and social movements. This “bottom-up” approach allows challenges to be defined in such a way that they speak to the lives of citizens.,This transformative process requires a new approach to policy-making which is referred to as a mission-oriented approach. Missions are tools for transformations aimed at solving crucial social, environmental and technological challenges, by means of a concrete process, characterised by achievable targets, and involving as many sectors as possible; public institutions, social organisations and above all citizens, thus putting the person and the community at the centre of the economy.,This philosophy means that we should start looking beyond GDP as the yardstick for development and the United Nations’ 17 Sustainable Development Goals (SDGs) are aimed to provide such a direction and to also highlight the economic, social and environmental challenges on a global scale.,Tackling and solving these challenges requires a fundamental change from traditional industrial policies. It is crucial to move from a logic centred on a list of sectors to be supported, towards a better and more complete identification of problems whose solutions require multiple sectors and actors to finance and develop processes of innovation and transformation.,The idea behind missions is not to start by asking which sectors or technologies should be helped, but rather which problems need to be solved. The key is to think about problems in the most ambitious way possible, involving various economic actors in the solution (public, private and non-profit) and establishing new forms of collaboration at the level of individual projects. Much of the discussion around missions can be conceptualised in terms of major challenges, which in the case of the United Nations are represented by the 17 SDGs. Transforming these challenges into concrete missions is the first step.,Missions should be cross-cutting in terms of sectors and actors involved in the process. In this sense, a “vertical” mission on a theme can have a cross-cutting impact on different economic and social areas. The dynamics are both top-down, in terms of directionality of the challenge and the identification of the mission, and bottom-up, with the activation of projects that involve multiple actors and solve the everyday problems of citizens.,The success of missions requires the fulfilment of a series of conditions, which must be embedded in the process before and during their execution.,First, they need to be bold, inspirational and with social relevance. The missions must be able to inspire the actors involved and have a broad relevance for society. They must be able to connect with the challenges of sustainable development to have an impact on a significant part of the population.,Secondly, missions require citizen involvement. For their definition, implementation and evaluation, missions require citizen participation in public debate. They must also be shared by a healthy number of institutional and social actors, so that they can also be pursued through different political cycles.,Third, they need to be targeted, measurable and time-bound. The missions must have a precise direction. They must be focused, measurable (with tools that capture the overall qualitative impact) and bound by a time limit.,Fourth, missions need to be backed by public sector capacity. Missions require the development of skills and entrepreneurial spirit by the state. Public actors must conceive of themselves as elements of a system that creates and shapes markets and technologies. Among the capacities that the state must assume there are: the search for coordination between different structures that operate by departmental silos; greater flexibility and autonomy of some departments, agencies or other public organisations; a positive approach to risk, linked to learning processes; the possibility of setting a strategic use of public procurement on the entire industrial and social apparatus.,Fifth, ambitious but realistic. The missions must be ambitious in order to motivate the actors involved, but sufficiently realistic to be achieved. The financing of projects, by public and private parties, must be adequate and follow the needs for the realisation of the mission, without constraining its definition with strictly fixed limits or a short-term return perspective.,Finally, cross-cutting and bottom-up. The potential of the missions is maximised by the activation of multiple initiatives between different sectors, actors and disciplines. Several projects contribute to the realisation of missions, as well as to their possible redefinition, through constraints and opportunities that may bubble up during their implementation.,The mission approach presented here provides a lens through which to rethink economic and industrial policy. It is an innovative way to collaborate across sectors inspired by the great challenges we face. It must involve different actors, from the institutional arena to the business world, from universities to the third sector."
https://www.newtimes.co.rw/sports/mugisha-could-miss-tour-du-rwanda-2021,"Mugisha ‘could miss’ Tour du Rwanda 2021
","Rwanda’s push to finally win Tour du Rwanda for the first time since 2019 could be thwarted by the sudden decision by in-form rider Moise Mugisha who recently announced that he could miss this year’s edition as a result of persistent disputes between the rider and his club SKOL Adrien Cycling Academy (SACA).,The 13th edition of the cycling race will run from May 2-9. It was initially scheduled to take place from February 21-28 but was postponed to contain the spread of Covid-19.,Mugisha has not been on good terms with his club since winning the Grand Prix Chantal Biya in November last year after he was denied a move out of the club to end long-standing feuds with his coach Adrien Niyonshuti.,While SACA refused to release Mugisha and instead left him out of the squad training for the Tour du Rwanda as disputes remain unsolved, the rider told , that he no longer sees himself playing under a coach who, he says, has been treating him badly adding that he prefers to miss out on this year’s Tour du Rwanda until his contract expires in September.,“How can I play under a coach who beats me? I can’t work with someone with whom I have disputes. I requested the club to let me go but I was threatened that I have nowhere else to go,” claims Mugisha.,“I can’t continue doing my job in such conditions. Of course, I am unlikely to increase my points if I don’t participate in this year’s Tour du Rwanda edition but there are still chances in future editions,” he added.,Mugisha’s relationship with his coach Niyonshuti has been strained since July last year when the duo was involved in a training bust-up.,Although he is regarded as one of the favorites to win this year’s Tour du Rwanda, the rider was left out of the team preparing for Tour du Rwanda 2021 and is not able to train on his own after he was requested by SACA to return cycling equipment.,Niyonshuti recently told the media that, despite recent impressive performance at Grand Prix Chantal Biya, the young rider’s lack of discipline could ruin his cycling career if he does not make the profession a priority.,The tactician said he would be happy to see Mugisha back in the group and focus together on winning the Tour du Rwanda.,“Mugisha is a good player but he needs someone to advise him to help him give his career a good direction. He is not part of the group currently training for Tour du Rwanda as long as his issue is not sorted yet but if he is ready to rejoin the team to prepare for Tour du Rwanda, I would love to see him back,” Niyonshuti said.,Mugisha wanted to part ways with SACA but the club didn’t want to, prompting the rider to submit a complaint to Rwanda Cycling Federation (FERWACY) in February but he claims his request fell on deaf ears.,“I submitted the complaint by email at the beginning of February but I haven’t got any feedback,” he said.,However, FERWACY President Abdallah Murenzi, told this publication that the federation has done everything possible to end the feud between Mugisha and his club but no solution has been secured yet.,“We spoke to SKOL’s boss Ivan [Wulfaert], the player and his coach to see if the case can be solved amicably but in vain. We are still trying to play our role as a mediator but if it doesn’t materialize, then they can go to court,” Murenzi said. ,“The federation has nothing to do with what the club and the player agreed in the contract and we feel a competent court can better intervene,” he added."
