page,title,article
https://www.newtimes.co.rw/lifestyle/spread-some-love,"Spread some love
","If you’re celebrating Valentine’s Day, chances are you’re grown, yet here I am about to tell you how to spend this weekend! By the way, I know you guys can’t see me but I just did an epic celebratory ‘Valentine’s Day falls on a Sunday this time’ dance. Not that I’m even remotely excited about the day itself, rather, the fact that being a Sunday and with curfews still on, not many people will venture out. For VD haters like myself, that’s great news as it means that should we venture out, we probably won’t run into smitten lovers all over the place and each other! That’s my hope anyway. I’ll miss the chocolate colleagues usually pass around though. And cake.,Someone save me a slice! I swear some bakeries make more on Valentine’s Day than the rest of the year! That may not be the case this year but I’m sure they’ll be alright. I was thinking though how great it would be if we switched things up. You know, do something nice for a stranger or someone you’re not romantically involved with or related to. If you chance upon those,‘Buy One, Get One Free’ offers, get the item/s and give the extra one to someone at your workplace or anyone you know is single or just lost a loved one. You can also re-gift certain things. My mum wouldn’t approve this particular one as she believes it’s wrong and rude to give away or sell a present, but I think if you’re not using it and someone else needs it, why hang onto it? If money is not an issue, do something akin to what some newlyweds do by asking their guests to donate to their preferred charity in lieu of buying them gifts. And instead of buying that hideous red outfit for yourself, (told you I’m a hater!) buy masks and other protective equipment for frontline workers or someone who needs them in your neighbourhood.,Skip the romantic dinner for two since you have to be home by 7pm anyway and instead, buy some groceries for someone struggling. Kind of hard to sacrifice your outing or getaway, especially couples who’ve been stuck at home for months and could use a change of scenery to get their groove back but still, what’s more fulfilling than knowing you helped someone in need?"
https://www.newtimes.co.rw/lifestyle/making-friends-introvert,"Making friends as an introvert
","Introverts tend to avoid interacting or social dealings all together. Being the type that is reserved, such people never seek special attention and would rather keep to themselves.,But humans—introvert or not—are social beings that need relations with close friends and associates in one way or another. This is where it becomes challenging.,Jenn Granneman, the founder of Introvert Dear, quotes Laurie Helgoe, author of Introvert Power: Why Your Inner Life Is Your Hidden Strength, comparing extroverts to hotels and introverts to luxury suites. Extroverts can accommodate a large number of interactions that come and go, while for introverts, bookings are limited.,She explains that when making friends, introverts are looking for friends who truly ‘get’ them. “The ultra-chatty extrovert who parties every weekend probably won’t be an introvert’s best friend. We are looking for people who understand our introversion, who can go deep, who run at our speed.”,Jose Uwamahoro a university student, says as an introvert, she understands that making friends is not easy mostly because introverted people rarely speak or form relationships for the sake of it.,They look for meaning, which means small talk is a no-go area for them, yet this is how people make new friends, she says. ,She considers it easy for such people to instead engage themselves in groups or events that interest them. These could be book clubs or movements for saving nature, such can be good to meet people with common interests.,Another way to form friendships, according to Enock Mutabazi, is practising socialising.  The best way to overcome a challenge is by facing it, he says. ,“If you want to make friends, you need to improve your ability to interact with others. The best way to do this is to try your level best to meet new people, and most importantly be willing to interact with them, even those you don’t know,” he says.,Granneman, on the other hand, is of the view that if you want to add some new faces to your inner circle, you don’t necessarily have to head to the nearest party or networking event. Chances are there are already people in your life who you would like to get to know better. Someone interesting, someone like-minded. So start by taking inventory of your acquaintances—that new person at work, a friendly neighbour, someone in your writers group whose work you admire. Identify one or two of these people to reach out to.,Granneman also encourages introverts to go ahead and make the first move.,Many introverts wait for others to come to them. Having survived our share of awkward interactions, we may worry about rejection. “What if I ask her to get coffee and she says no?” Or worse, “What if he gets to know me better and doesn’t like who I am?” The process of making new friends can fill anyone with self-doubt, even the most confident among us. And if you’re an introvert who has experienced significant rejection (as many of us have), you may feel like simply giving up, she writes.,Granneman also highlights the relevance of asking questions. Inevitably, when we meet new people, we have to do what every introvert dreads: talk about ourselves. Often, this is enough to stop a blossoming friendship in its tracks, she notes. However, she adds, the conversation doesn’t have to be all about you. Introverts have a superpower; listening. So get the other person talking by asking them questions: “What’s new in your life?” “What’s something you’ve learned recently?” “If you could have any career you wanted, what would it be? Why?”,Listening takes the spotlight off you, and most non-introverts love to talk about their favourite subject: themselves."
https://www.newtimes.co.rw/lifestyle/6-ideas-valentines-day,"6 ideas for Valentine’s Day
","February is the month of love and Valentine’s Day is just around the corner. Normally, people tend to go out of their way to express their love for each other, however, it might be different this year. ,With the current situation that still has restrictions on travel and social gathering, couples are faced with limited options on how they can celebrate. Nonetheless, this shouldn’t limit those who are looking forward to making the most of this day. Below are a few ‘date ideas’ that can help you enjoy this year’s Valentine’s Day with your significant other. ,Author Emily Swop commends the beauty of taking walks as a couple. This, she says, can be after dinner or hiking together. To her, this can change up your normal routine; you can take turns choosing which direction to go at each crossroad. While you’re at it, step off the sidewalk or road, and explore. Is there a pond or forest nearby that you have never ventured into? Use your photography skills, and take some creative photos together along the way, she writes.,A special home-cooked meal has always been much more romantic than eating out. If food is the way to your heart as a couple, then spending time in the kitchen preparing a meal together can be a great way to celebrate Valentine’s Day. Take turns cooking each other’s favourite dishes, and when you are done, wine and dine together, this will also help you create new memories for your relationship or marriage.,Tourism is still open for those who wish to spend time, for example, at a park or game reserve. Book early and plan on how you can make the best out of this time together. You can decide to spend a day or an entire weekend as you explore. And for more fun, you can even choose a destination that both of you have never been to, this will help you get out of your comfort zone and have a wonderful time together.,Have a good time with your mate by simply playing your favourite games as a couple. Therapists say playing games can help build stronger relationships. It takes the heat and stiffness out of a relationship. At times, as a couple you need to relax from the stress and daily obligations of making a relationship work and just have fun. On this Valentine’s Day, let it be the day you relax and spend this time together, just the two of you. Showing love and how much you care about your partner does not necessarily mean spending a lot of money on fancy dinners or flowers, at times spending time with them can be the best gift you can give them.,Taking a hike is a great way to unplug and unwind with your partner. This Valentine’s Day, choose a scenic spot where you and your partner can enjoy nature and have fun too. Hiking with a partner is also believed to be an incredibly rewarding activity done as a couple and that it can strengthen a relationship greatly as well.,A move night is always a great way of spending time together as a couple, especially if you are both movie lovers. And as it turns out, there are also advantages of watching movies together as a couple, for instance it can be a nice opener for a conversation. This Valentine’s, make your day memorable by simply selecting a few of your favourite movies and binge watch throughout the day. "
https://www.newtimes.co.rw/lifestyle/hide-it-till-you-tie-it-knot,"Hide it till you tie it (the knot)
","At first, I thought it was a thing for overly spiritual people, then afterwards, I imagined it could be a personality thing, but then I realised that the paranoia of going public about happy moments, especially relationships before marriage, is real. And it got me really wondering, who started this and why? ,We know that Adam and Eve should be blamed for most pains that come to us in life; cramps, job hurdles, name it. But who should be blamed for the normalisation of hiding beautiful things?,Why can’t I casually post a happy picture of myself with le boyfriend without necessarily raising eyebrows?  Recently, Juju la Belle tweeted: “Here is a theory that I don’t understand about keeping your partner off social media until you’re engaged/ready for marriage. ‘What if they break up with you after that?’ …Live every happiness as it was the last. What if you die today? Make yourself happy. Only You.”,It’s not like we are planning on dying, really. We’re here for a long, good time but it is ridiculous to hold our breaths till the day we feel ‘safe’ about our little happy world. ,While I was celebrating my birthday two weeks ago at the coast (even the memory of it makes me smile so widely), I took a little video of my drink, the saxophone, and the blue waters bordered by beautiful white sand. Oh, the video had nice background music too (Sauti Sol). A few minutes later, my saxophone mouthpiece fell headfirst and got broken so I couldn’t continue with the ‘birthday concert’. ,About an hour later after I had even ‘moved on’, my friend saw my status and he jokingly said that someone saw the video and spat, sending the mouthpiece to an early grave. I laughed so hard at that. But apart from it being hilarious, he went ahead and explained that several people do not share their happy moments, not because they are introverted or private, but due to fear of enemies of progress. ,I found this fact so sad. That we have to hide our beautiful lives and success in a dark room and even put a padlock until they ‘mature’. Businesses aren’t hidden until they mature, though. The minute one starts rearing chicken, for instance, they immediately send the word out without necessarily thinking about the enemies of progress. Is the ‘spitting ideology’ only customised for relationships and pregnancies?,I know this could also come from a place of trauma, and I truly wish you complete healing if you were ever in a relationship with someone and things didn’t work out. I was too, LOL. Back when I was young and fun. Heck, we even exchanged names on Facebook. It was an East African affair if you ask me. ,Looking back, though, it was a silly, childish move but I would not say that I regret it because it gave me so much joy back then. You don’t need much to make a 20-year-old happy, really and besides, it was the trend back then so we were cool and sure did enjoy it while it lasted. ,I came to understand that if one posts a picture of a young relationship that hasn’t reached the engagement or wedding level yet, the responses they receive from their contacts include things like, ‘why are you posting him if you don’t know if he is the one for sure’ and ‘did you get engaged and didn’t tell us?’ Like no, Susan. I don’t know if he is ‘the one’ because they don’t come with an ear tag, like cows. But I would sure love to enjoy every step of the relationship my way. ,Who introduced this ‘hide it till you tie it’ policy? It sure does need to be revised."
https://www.newtimes.co.rw/lifestyle/do-you-believe-valentines-day,"Do you believe in Valentine’s Day?
","February 14 will be Valentine’s Day. Also known as Saint Valentine’s Day, it is celebrated annually. Usually on this day, people surprise their loved ones with gifts, lunch and dinner dates, cards, flowers, among other things, as a gesture of love. ,asked a variety of people what their views on celebrating the day are.,Personally, I think a strong couple doesn’t need to celebrate Valentine’s Day to prove their love. Valentine’s Day has become a highly commercialised day of ‘forced love’. Quality love shouldn’t be celebrated on one day a year. Love can be expressed 365/366 days a year. What hurts is that commercials exaggerate it—they imply that if you don’t gift your lover on this day, you don’t love them, which isn’t true.,Yes, I do believe in celebrating Valentine’s Day. I know it’s a symbolic day to consider the love that we give daily and think about how to improve. This love isn’t only for relationships. It cuts across religion too.,Although every day is a day for us to celebrate our loved ones, just like a birthday or any other special day, I like to remind my wife how special she is to me. It gives us a chance to add ‘spice’ to our relationship, and I know how special the day is to her, so I do it to put a smile on her face. She does the same for me. So, if your significant other or loved one likes a little surprise on Valentine’s Day, just do it without over-thinking. The rewards of making them smile will be harvested with two hands.,I feel like it can be theorised. As we celebrate any religious holy day including Christmas, for the sake of giving value to a certain activity which might have either happened or been recognised on that day, yes, we then need to value what St. Valentine did. But again, this day seems to have lost the value we used to give it. Currently speaking, Valentine’s Day became more of a day for romantic couples to have fun, go out—more of a vacation day. On that note, I wouldn’t judge those who decide not to waste their time and money, and completely take it as any other day.,I don’t believe in celebrating a particular day for our loved ones, but I consider celebrating Valentine’s Day every day. This is because we must love every day and unconditionally. Thus, there is no special day to show your partner how grateful you are for their presence in your life, instead, every single day must be seen as an opportunity to celebrate love.,Business-wise, Valentine’s Day is the perfect day to raise sales, but family-wise, it is really pointless, because I believe that to people who truly love one another, every day is Valentine’s Day.,Much as I don’t mind the celebrations, they are not a big deal to me because one thing I do believe in is the daily celebration of love. I love surprises and if my boyfriend or any person I love surprises me, or not, I will still love them as much as I have always.,We have different opinions about Valentine’s ,Day but it doesn’t really matter whom you choose to celebrate it with. Or if you choose not to celebrate. It all comes down to one’s choice or belief. Though it’s a day to show affection to the ones we care about.  It could be a partner, friend, parent, or any other family member, a workmate, not forgetting yourself. This can be the day people reconcile with one another. Letting go of the past and what hurt them. It also brings out a clear picture of what love is about and caring for one another.,If I am surprised with gifts on any day, it still means as much on Valentine’s Day. The acts on Valentine’s Day should be done on other days too. I won’t feel bad if my boyfriend fails to do something special on Valentine’s Day because I know he has proved that he loves and cares about me and our relationship in many ways. Not making it a special day doesn’t make him half a man. He remains the same man that melted my heart years back. "
https://www.newtimes.co.rw/opinions/editorial-hard-work-well-emerge-covid-induced-slump,"Editorial: With hard work, we’ll emerge from the Covid-induced slump
","During the occasion of the National Prayer Breakfast, the Head of State challenged leaders to double their efforts in delivery so that the country can recover from the slump caused by the coronavirus outbreak.,According to the President, a lot has been lost in the past one year as the country instituted measures to curtail the devastation from the virus that has ravaged global order.,While the worst of the devastation may have been avoided owing to the robust measures that were rolled out in the early stages of the pandemic, the economy has greatly been affected.,The national economy contracted considerably, many people lost their jobs, while businesses have closed.,Available statistics show that up to 7,401 jobs have been lost in agro-processing, 13,000 in mining, and 2,644 in energy among many sectors.,Industries like hospitality are still limping, while others have begun to take off.,However, the worst consequences of pandemic – big human loss - has potentially been avoided, while the vaccines which are already being distributed allows the country to look forward to a future without Covid-19 and to rebuilding the economy.,Already in Rwanda, nearly 350,000 people from the most exposed groups – frontline workers, people working in security, those with underlying conditions, and people of advanced age among others – have received their first shots and the second ones are on their way.,Through different channels, government is looking to continue procuring vaccines and the target is to inoculate 30 per cent of the population at the end of 2021 and double that by June 2022.,With such effort to keep the virus at bay, the remaining wall to scale is reviving the economy from the devastation it has been plunged in.,Already, multiple interventions have been deployed, like the Economic Recovery Fund in which the government looks at sinking Rwf350 billion to help accelerate the recovery of businesses most affected by Covid-19.,Just recently, another intervention was launched – the Manufacture and Build to Recover Programme – which seeks to extend tax breaks and tax credits to businesses with an aim to reduce cost of investment for new manufacturers as well as those seeking to expand existing operations.,All these interventions seeks to buttress Rwandans against the shocks of Covid-19 but it will require hard work from everyone – both in public and private sector – to ensure these interventions yield the desired results and eventually put back our economy on good footing."
https://www.newtimes.co.rw/opinions/editorial-economic-recovery-plans-should-address-gender-based-financial-exclusion,"Editorial: Economic recovery plans should address gender-based financial
exclusion
","In June this year, Rwanda will roll out the second phase of the ,, which is designed to support business activity and put the economy back on the right footing.,The announcement, which was made at , of the officials from the government and development partners, coincided with a new report highlighting gender-based exclusion in the country.,The FinScope 2020 report says that despite ,, women still lag behind their male counterparts in terms of ,, hence denting efforts meant to promote women economic empowerment.,The government has initiated various programmes that have helped bridge the gender gap—including propelling women to senior leadership position and increased the enrolment of girls in schools among others.,However, some challenges have persisted.,Compared to men, women still have less access to digital and financial services—making it hard for them to carry out transactions, payments, savings, access credit and insurance products.,In addition to limitations with income, the report states that broader societal issues such as cultural norms and belief systems, limited access to land or property, family responsibilities and mobility constraints are the other challenges affecting women’s levels of financial inclusion.,We don’t know yet the full extent of how the Covid-19 crisis has exacerbated these challenges.,However, whereas we all have been affected by the pandemic—from being confined at home, to losing jobs and loved ones—vulnerable groups like women appear to be bearing the brunt of the virus.,Majority of women are employed in the informal sector, which is the hardest hit by the pandemic.,For instance, restricted mobility aimed at dealing with the virus has ,.,In addition, the lockdowns exposed some women to various cases of gender-based violence and exacerbated their burden of care work.,This is why all policies aimed at rebuilding the economy must account for the impact of Covid-19 on women; from supporting women businesses to underscoring their role in mitigating the impact of the pandemic.,The FinScope report says that when women actively participate in the financial system, they can better manage risk, smooth consumption in the face of shocks, or fund household expenditures."
